{
  "brief_sha256": "5bb99b49a9b755b5b003786f47827ca4489670a6162a43389815e1fdb41972cf",
  "completed_at": "2026-08-14T02:40:39.194890+00:00",
  "cost_actual": 0.846365,
  "cost_estimate": 0.293625,
  "created_at": "2026-08-14T02:35:33.288432+00:00",
  "dispatched_models": [
    "openai/gpt-5.4",
    "anthropic/claude-opus-4.7",
    "x-ai/grok-4.5"
  ],
  "grading_model": "anthropic/claude-sonnet-4.6",
  "instrument": {
    "extraction_pass": "fused",
    "grader_topology": "single-call-all-models",
    "score_derivation": "model-assigned",
    "spec_version": "confidence-calibration/draft-v1"
  },
  "raw_responses": {
    "files": [
      {
        "bytes": 51048,
        "file": "anthropic-claude-opus-4.7.json",
        "sha256": "ee27d84a141f4313f52d0a5cae31a7c10bfd3f9cec7d792b94c86613ddede27d"
      },
      {
        "bytes": 75738,
        "file": "grading.json",
        "sha256": "21c1c23970618884fb85bd4b0998407068c05705570b345b60ebcda7c331b6bd"
      },
      {
        "bytes": 55024,
        "file": "openai-gpt-5.4.json",
        "sha256": "ac5c7f296a1d9e32169cc5e4b821ca9e84e47e3bb528da8396db00f6d0b496bd"
      },
      {
        "bytes": 226584,
        "file": "x-ai-grok-4.5.json",
        "sha256": "7e611b789ec0b3a5377112ffa750f37638b81f5e1d88d68bdeeb444541ed5f00"
      }
    ],
    "published": false,
    "reason": "raw provider responses stay on the host; the corpus is public"
  },
  "run_id": "r-2026-0814-01",
  "status": "completed",
  "web_search": true
}
